<?xml version="1.0" encoding="utf-8" ?>

<PlaylistModifier
xmlns:xsi="http://www.w3.org/2001/XMLSchema-instance"
xsi:noNamespaceSchemaLocation="..\..\Playlist Management\PlaylistModifiers\PlaylistModifier.xsd">

  <Type>LastFM</Type>
  
  <UI>
    <DisplayName>Last.FM Artists by Tag</DisplayName>

    <Inputs>
      <Input>
        <ID>1</ID>
        <UILabel>Tag</UILabel>
      </Input>
    </Inputs>
  </UI>

  <Action>Add</Action>

  <ModifierKey>LastFM_SimilarTracks</ModifierKey>

  <Method>
    <LastFMrequest>
      <RequestURL>
        <TemplateURL>http://ws.audioscrobbler.com/2.0/?method=tag.gettopartists&amp;tag=[Tag]&amp;api_key=e295ea662af320c44101419cb30cfffe </TemplateURL>
        <TemplateMappings>
          <Mapping>
            <ID>1</ID>
            <ToReplace>[Tag]</ToReplace>
            <InputID>1</InputID>
          </Mapping>
        </TemplateMappings>
      </RequestURL>

      <Response>
        <Outputs>
          <Output>
            <ID>1</ID>
            <WMP_Attribute>Artist</WMP_Attribute>
            <xPath>//topartists/artist/name</xPath>
          </Output>
        </Outputs>
      </Response>
    </LastFMrequest>
  </Method>
</PlaylistModifier>